<?xml version="1.0" encoding="UTF-8"?>
<!ELEMENT users (user+)>
<!ELEMENT user EMPTY>
<!ATTLIST user
	id CDATA #REQUIRED
	panelset CDATA #REQUIRED
	engset CDATA #REQUIRED
>
